{
  "schema": 1,
  "review_status": "draft",
  "author": "hand",
  "topicId": "m3a.2.6",
  "name": "解决问题(两种思路)",
  "tier": "core",
  "hook": "男生 12 人、女生 10 人，每人发 2 本本子。先算总人数再乘，和先分别算再相加，凭什么答案一样？",
  "definition": "同一个问题可以从不同角度列式，正确的结果必须相同。两种思路之间往往正好是乘法分配律：(12+10)×2 = 12×2+10×2。",
  "why": "不管先把人合起来再发，还是先给男生发、再给女生发，本子的总数不会因为发的顺序而改变——这是总量的守恒。两种算法相等，正好说明分配律不是规定，而是事实。",
  "when_to_use": [
    "题里有两类对象，却共用同一个「每份数」",
    "可以先合并再乘，也可以分别算再相加",
    "题目要求「用两种方法解答」或「你还能怎样算」"
  ],
  "steps": [
    "用第一种思路列式并算出结果",
    "换一个「先求什么」再列一次",
    "比较两个结果是否相同",
    "说出两种思路各自第一步求的是什么"
  ],
  "worked_example": {
    "prompt": "会议室每排摆 3 张桌子，先摆了 4 排，又搬来 6 排同样的桌子，现在一共有多少张？",
    "verify": "3*4+3*6",
    "answer": "30",
    "steps": [
      "思路一：先分别算两批。3×4=12 张，3×6=18 张，合起来 12+18=30 张。",
      "思路二：先算一共几排。4+6=10 排，每排 3 张，3×10=30 张。",
      "两个结果都是 30，说明 3×4+3×6=3×(4+6)。"
    ]
  },
  "pitfalls": [
    "把「又搬来 6 排」当成「一共 6 排」，于是算成 3×6=18 张。",
    "两种思路算出不同结果，随手挑一个写上去，不回头查哪步错了。",
    "只会一种解法，就以为题目只有一种做法。"
  ],
  "practice": [
    {
      "id": "m3a.2.6-q1",
      "note": "先合并再乘：最顺的一种"
    },
    {
      "id": "m3a.2.6-q2",
      "note": "说出第二种算式长什么样"
    },
    {
      "id": "m3a.2.6-q95",
      "note": "换成「整排 + 零散」，两种思路不再对称，检验是否真懂"
    }
  ],
  "check": "对同一道题写出两个不同算式，说明各自先求什么，并指出两式相等的原因。",
  "content_revision": {
    "author_type": "ai",
    "date": "2026-10-26",
    "teacher_review": "pending"
  },
  "objective_coverage": [
    {
      "criterion_index": 0,
      "title": "能用两种思路解决同一问题",
      "explanation": "每人份数相同时，可先合人数再乘，也可先分别求各组总量再相加。",
      "self_check": {
        "prompt": "甲组12人、乙组8人，每人2本。用两种思路求总本数。",
        "reference_answer": "(12+8)×2=40；12×2+8×2=24+16=40。",
        "criteria": [
          "两式均正确",
          "两种思路各有数量解释"
        ]
      }
    },
    {
      "criterion_index": 1,
      "title": "能比较两种思路的异同",
      "explanation": "比较解法要指出中间量的不同与最后总量一致，并说明共用的条件。",
      "self_check": {
        "prompt": "上一题两种方法为什么相等？若甲每人2本、乙每人3本，还能先合人数乘2吗？",
        "reference_answer": "相等因为两组每人均2本；若份数不同不能合人数乘2，应12×2+8×3。",
        "criteria": [
          "识别同份数条件",
          "说明变条件后原简法不适用"
        ]
      }
    }
  ]
}
