{
  "schema": 1,
  "review_status": "draft",
  "author": "hand",
  "topicId": "m1a.2.10",
  "name": "10 的加、减法",
  "hook": "10 是第一个「整十」，把 10 的组成练熟，后面凑十法、破十法都靠它。",
  "definition": "若两部分都为正数且不区分次序，10的组成有1和9、2和8、3和7、4和6、5和5五组；允许0时还有0和10。交换两个部分不改变总数。",
  "steps": [
    "先把五组组成背到「条件反射」。",
    "见到 10 - 7：想「7 和几合成 10」，答案是 3。",
    "见到 6 + 4：想「6 和 4 合成 10」，答案是 10。",
    "把「凑十」当成一个动作来练：看到 8 就想 2，看到 7 就想 3。"
  ],
  "worked_example": {
    "prompt": "盒子里有 10 颗糖，拿走 7 颗，还剩几颗？",
    "verify": "10-7",
    "steps": [
      "总数是 10，拿走 7，求剩下。",
      "想 10 的组成：7 和 3 合起来是 10。",
      "所以 10 - 7 = 3（颗）。",
      "验算：3 + 7 = 10，对了。"
    ],
    "answer": "3"
  },
  "pitfalls": [
    "10 - 6 答成 3（把 6 的凑数记成 3）。要记「6 的凑数是 4」。",
    "只背「1 和 9」，做题时换成「9 和 1」就卡住——组成要双向熟。"
  ],
  "practice": [
    {
      "id": "m1a.2.10-q1",
      "note": "10 以内的加法"
    },
    {
      "id": "m1a.2.10-q2",
      "note": "10 以内的减法"
    },
    {
      "id": "m1a.2.10-q90",
      "note": "变式：换个问法"
    }
  ],
  "check": "任报一个 10 以内的数，能立刻说出它的「凑十伙伴」（如 7→3）；10 的加减法口算全对。",
  "why": "10 是十进制里第一个「整十」，凑十法、破十法、进位退位都以它为中转站。10 的五组组成背到不用想，后面 20 以内的加减才快得起来。",
  "when_to_use": [
    "算式里要凑成 10（9+1、8+2、7+3）",
    "算 10 减几，或学凑十法、破十法之前的热身"
  ],
  "content_revision": {
    "author_type": "ai",
    "date": "2026-10-26",
    "teacher_review": "pending"
  }
}
