{
 "schema": 1,
 "review_status": "draft",
 "author": "ai",
 "author_type": "ai",
 "topicId": "m9a.27.3",
 "name": "实际问题与反比例函数",
 "tier": "core",
 "hook": "路程固定时速度加倍，时间减半；哪些假设让这个关系成立？",
 "definition": "当两个量的乘积为定值时它们成反比例关系，如路程一定时速度与时间、面积一定时长与宽；可用反比例函数模型求解实际问题。",
 "why": "s=vt给出固定路程s下vt为常数，因此时间t=s/v；若路程、停靠时间或工作效率发生改变，乘积不再恒定，原反比例模型就失效。应用时须先找出固定量，再限定正值与容量条件。",
 "when_to_use": [
  "固定路程下比较速度与时间",
  "总工作量一定且总效率与人数成比例"
 ],
 "steps": [
  "明确恒定的总量以及单位",
  "写乘积等式并转为反比例函数",
  "在正值可行范围内求解，检查模型假设"
 ],
 "worked_example": {
  "prompt": "路程120千米，按恒定速度v千米/小时行驶且不停靠，写时间函数并求v=60时的时间。",
  "answer": "t=120/v（v>0），时间2小时",
  "steps": [
   "由路程=速度×时间得vt=120，所以t=120/v。",
   "v=60时t=120/60=2小时，符合正值范围。"
  ]
 },
 "pitfalls": [
  "速度与时间反比要求路程不变，不同路程不能直接比较。",
  "人数加倍未必效率加倍，只有明确等效率且协作不受影响时可这样建模。"
 ],
 "check": "独立完成并解释：同一批固定60件任务，每小时完成q件，假设效率恒定且无准备时间，完成时间t与q是否成反比？；固定路程180千米，不停靠匀速行驶，计划3小时完成，所需速度是多少？若4小时完成呢？",
 "objective_coverage": [
  {
   "criterion_index": 0,
   "title": "能判断两个量是否成反比例",
   "explanation": "两个量成反比例须有同一非零乘积，不只是看升降趋势。",
   "self_check": {
    "prompt": "同一批固定60件任务，每小时完成q件，假设效率恒定且无准备时间，完成时间t与q是否成反比？",
    "reference_answer": "是，qt=60，t=60/q，q>0，固定的是总任务60件；若另加固定准备时间，总时间就不再是这个反比例式。",
    "criteria": [
     "给出恒定乘积",
     "说明假设边界"
    ]
   }
  },
  {
   "criterion_index": 1,
   "title": "能用反比例函数解决实际问题",
   "explanation": "反比例模型求值前需核对单位和正值限制。",
   "self_check": {
    "prompt": "固定路程180千米，不停靠匀速行驶，计划3小时完成，所需速度是多少？若4小时完成呢？",
    "reference_answer": "v=180/t；3小时需60千米/小时，4小时需45千米/小时。两次v·t均为180。",
    "criteria": [
     "时间速度单位一致",
     "两结果及乘积验算正确"
    ]
   }
  }
 ],
 "practice": [
  {
   "id": "m9a.27.3-q1",
   "note": "独立作答后，按解析检查关键条件和推理。"
  },
  {
   "id": "m9a.27.3-q101",
   "note": "独立作答后，按解析检查关键条件和推理。"
  },
  {
   "id": "m9a.27.3-q102",
   "note": "独立作答后，按解析检查关键条件和推理。"
  }
 ]
}
