{
 "schema": 1,
 "review_status": "draft",
 "author": "ai",
 "topicId": "mh2.10.1.2",
 "name": "事件的关系与运算",
 "tier": "core",
 "hook": "‘掷出1’与‘掷出2’互斥，但为什么不是对立事件？",
 "definition": "事件之间的包含、并、交、互斥与对立关系，可用集合语言与 Venn 图表示。互斥要求A∩B=∅；对立还要求A∪B=Ω。并表示至少一个发生，交表示同时发生。",
 "why": "互斥只排除共同发生，并未排除两者都不发生。对立要求每个样本点恰落入二者之一，因而同时满足互斥与穷尽；集合运算可逐点检查这些逻辑要求。",
 "when_to_use": [
  "判断两个事件是否互斥、对立或包含",
  "将‘至少一个’‘同时’‘没有’改成集合式"
 ],
 "steps": [
  "先列清同一试验的样本空间",
  "分别求两事件的交与并",
  "交空判互斥，再看并是否为Ω，最后写事件运算"
 ],
 "worked_example": {
  "prompt": "掷六面骰，A={1}、B={2}、C={2,3,4,5,6}，比较A与B、A与C。",
  "steps": [
   "A∩B为空，但并集只有{1,2}，遗漏3至6。",
   "所以A、B互斥不对立。",
   "A∩C为空且A∪C=Ω，所以A、C对立。"
  ],
  "answer": "A、B互斥不对立；A、C对立"
 },
 "pitfalls": [
  "把互斥直接当对立",
  "把至少一个发生写成只发生一个，漏掉交集"
 ],
 "objective_coverage": [
  {
   "criterion_index": 0,
   "title": "能判断两个事件是否互斥或对立",
   "explanation": "是否对立还要检查两者是否覆盖全部结果。",
   "self_check": {
    "prompt": "掷骰，A为偶数，B为奇数，C为点数大于4，判断A与B、A与C。",
    "reference_answer": "A、B互斥且对立；A∩C={6}，所以A、C不互斥也不对立。",
    "criteria": [
     "交并集合支持判断",
     "识别共同样本点6"
    ]
   }
  },
  {
   "criterion_index": 1,
   "title": "能用集合运算表示事件的运算",
   "explanation": "并、交、补分别对应或、且、非，差集表示A发生而B不发生。",
   "self_check": {
    "prompt": "A={1,2,3}、B={3,4}、Ω={1,2,3,4,5,6}，写‘至少一个发生’及‘A发生但B不发生’。",
    "reference_answer": "A∪B={1,2,3,4}；A∩Bᶜ={1,2}。",
    "criteria": [
     "两个事件运算及集合正确",
     "不漏掉并集共同点3"
    ]
   }
  }
 ],
 "check": "独立完成两项自检并保留推导或作图：交并集合支持判断；两个事件运算及集合正确。过程目标按下列量规逐项核对，不由一道客观题的得分代替。",
 "practice": [
  {
   "id": "mh2.10.1.2-q201",
   "note": "完成后核对解析中的条件与步骤；完整目标另做下方独立自检。"
  },
  {
   "id": "mh2.10.1.2-q202",
   "note": "完成后核对解析中的条件与步骤；完整目标另做下方独立自检。"
  },
  {
   "id": "mh2.10.1.2-q203",
   "note": "完成后核对解析中的条件与步骤；完整目标另做下方独立自检。"
  }
 ]
}
