{
 "schema": 1,
 "review_status": "draft",
 "author": "ai",
 "author_type": "ai",
 "topicId": "m7b.11.2",
 "name": "一元一次不等式",
 "tier": "core",
 "hook": "解不等式步骤像解方程，但哪一步不能照搬等式的处理？",
 "definition": "只含一个未知数且次数为 1 的不等式叫一元一次不等式；解法与一元一次方程类似，去分母、系数化 1 时要注意变号。",
 "why": "每一步变形应保留原来的全部解；加减、乘正数保持次序，乘负数反向才能保留同一批数。去分母也只是乘法，因此关键不是“去分母”这个名称，而是所乘数的符号。",
 "when_to_use": [
  "未知数最高次数为1的不等式",
  "带括号、分母或负系数的范围问题"
 ],
 "steps": [
  "选正公分母清除分母并展开括号",
  "把未知项和常数分别归并",
  "系数化1时检查正负，再画出完整解集"
 ],
 "worked_example": {
  "prompt": "解2−3x<8，并在数轴表示。",
  "answer": "x>−2；−2处空心向右",
  "steps": [
   "移项得−3x<6。",
   "同除以−3须反向，得x>−2；数轴上−2不取，向右延伸。"
  ]
 },
 "pitfalls": [
  "去分母时每一项都要乘，常数项不能漏。",
  "端点是否取到由最后的<或≤决定，不能凭习惯填实心。"
 ],
 "check": "独立完成并解释：解不等式3(x−2)≤x+4，写出解集。 请写出判断或计算依据。；解不等式(1−x)/2>3，写出解集。 请写出判断或计算依据。",
 "objective_coverage": [
  {
   "criterion_index": 0,
   "title": "能解一元一次不等式并在数轴上表示解集",
   "explanation": "正确解集包含端点判断及数轴方向，而非只给某个解。",
   "self_check": {
    "prompt": "解不等式3(x−2)≤x+4，写出解集。 请写出判断或计算依据。",
    "reference_answer": "展开得3x−6≤x+4，移项合并得2x≤10，同除以正数2得到x≤5。",
    "criteria": [
     "等价变形至x≤5",
     "数轴5处实心向左"
    ]
   }
  },
  {
   "criterion_index": 1,
   "title": "能正确处理去分母与系数化为 1 时的变号",
   "explanation": "去分母与除负系数分开判断符号，避免反向两次或漏反向。",
   "self_check": {
    "prompt": "解不等式(1−x)/2>3，写出解集。 请写出判断或计算依据。",
    "reference_answer": "两边同乘正数2，得1−x>6；移项得−x>5；再除以−1需反向，得到x<−5。",
    "criteria": [
     "乘2方向保持",
     "除−1方向反转"
    ]
   }
  }
 ],
 "practice": [
  {
   "id": "m7b.11.2-q201",
   "note": "独立作答后，按解析检查关键条件和推理。"
  },
  {
   "id": "m7b.11.2-q202",
   "note": "独立作答后，按解析检查关键条件和推理。"
  },
  {
   "id": "m7b.11.2-q1",
   "note": "独立作答后，按解析检查关键条件和推理。"
  }
 ]
}
