{
  "schema": 1,
  "review_status": "draft",
  "author": "ai",
  "tier": "core",
  "hook": "一盒有9支彩笔，拿走4支，留下的为什么不用把两个数相加？",
  "definition": "已知原来的总数，去掉其中一部分，求剩余部分用减法。被减数是原来的总数，减数是去掉的数量，差是剩余的数量。",
  "why": "原来的物体分为去掉和剩余两部分。从总数中去掉已知的那一部分，留下的就是另一部分；也可用“去掉的+剩余的=原来总数”检查。",
  "when_to_use": [
    "已知原来数量和用去数量，求还剩多少",
    "知道总数和其中一部分，求另一部分数量"
  ],
  "steps": [
    "指出原来总数、去掉数量和所求剩余数。",
    "用总数减去去掉的数量，不能颠倒。",
    "计算后把差与去掉的数量相加，核对总数。"
  ],
  "worked_example": {
    "prompt": "有9支彩笔，拿走4支，还剩几支？",
    "steps": [
      "剩余数=原来数−拿走数。",
      "9−4=5；5+4=9，符合原来的9支。"
    ],
    "answer": "5",
    "verify": "9-4"
  },
  "pitfalls": [
    "拿走数不能大于原来数；条件不合理时先检查题意。",
    "“剩下”描述的是哪一组要说清，不能减错总数。"
  ],
  "check": "先独立完成下面两项目标自检，再展开参考答案，逐条检查列式、过程和结果的意义。",
  "topicId": "m1a.2.6",
  "name": "用减法解决问题",
  "content_revision": {
    "author_type": "ai",
    "date": "2026-10-26",
    "teacher_review": "pending"
  },
  "objective_coverage": [
    {
      "criterion_index": 0,
      "title": "能判断“求剩余”用减法",
      "explanation": "从整体去掉已知部分，剩余部分可用减法求出。",
      "self_check": {
        "prompt": "桌上有8块积木，用去3块。说明为什么求剩余用减法。",
        "reference_answer": "8块是整体，3块是从这8块里用去的部分，所以从8中去掉3。",
        "criteria": [
          "识别整体8和部分3",
          "说明去掉而非合并"
        ]
      }
    },
    {
      "criterion_index": 1,
      "title": "能列减法算式并算出结果",
      "explanation": "差要与情境对应，并可用加法验算。",
      "self_check": {
        "prompt": "10张纸用了6张，还剩多少张？列式并验算。",
        "reference_answer": "10−6=4（张）；4+6=10，还剩4张。",
        "criteria": [
          "正确列减法",
          "结果4且加法验算正确"
        ]
      }
    }
  ],
  "practice": [
    {
      "id": "m1a.2.6-q1",
      "note": "完成后说清数量关系与每步依据。"
    },
    {
      "id": "m1a.2.6-q101",
      "note": "完成后说清数量关系与每步依据。"
    },
    {
      "id": "m1a.2.6-q102",
      "note": "完成后说清数量关系与每步依据。"
    }
  ]
}
