{
 "schema": 1,
 "review_status": "draft",
 "author": "ai",
 "author_type": "ai",
 "topicId": "m9b.31.2.3",
 "name": "相似三角形的性质",
 "tier": "core",
 "hook": "把三角形每边放大3倍，周长与面积分别放大几倍？为什么不同？",
 "definition": "相似三角形对应边成比例、对应角相等；对应高的比、对应中线的比、对应角平分线的比都等于相似比，周长比等于相似比，面积比等于相似比的平方。",
 "why": "周长由边长相加，每条都乘k，和也乘k；面积由底与对应高相乘，两者都按k缩放，所以面积乘k²。对应角保持，角平分线、中线、高等对应线段也按同一个长度比变化。",
 "when_to_use": [
  "已知相似三角形求边、高、周长或面积",
  "需要从面积比反推相似比"
 ],
 "steps": [
  "先固定两图的相似比方向",
  "长度与周长用k，面积用k²",
  "若给面积比先开平方再处理长度，核查单位"
 ],
 "worked_example": {
  "prompt": "△ABC∽△DEF，AB:DE=2:5，△ABC周长14、面积8，求另一图周长与面积。",
  "answer": "周长35，面积50",
  "steps": [
   "长度放大5/2倍，所以周长14×5/2=35。",
   "面积放大(5/2)²倍，所以面积8×25/4=50。"
  ]
 },
 "pitfalls": [
  "面积比不是相似比，必须平方。",
  "由面积比求长度比只取正值，因为长度比为正。"
 ],
 "check": "独立完成并解释：若相似比为小:大=1:4，小图对应高为3，求大图高及两图周长比、面积比。；两个相似三角形的面积比为9:25，小三角形周长18厘米，大三角形周长多少厘米？ 请写出判断或计算依据。",
 "objective_coverage": [
  {
   "criterion_index": 0,
   "title": "能说出相似三角形的性质",
   "explanation": "相似保持对应角，相应线段与周长同倍缩放，面积按平方倍缩放。",
   "self_check": {
    "prompt": "若相似比为小:大=1:4，小图对应高为3，求大图高及两图周长比、面积比。",
    "reference_answer": "大图高12，周长比1:4，面积比1:16；相应角相等。",
    "criteria": [
     "线段周长同用4倍",
     "面积采用16倍"
    ]
   }
  },
  {
   "criterion_index": 1,
   "title": "能用相似比求周长比与面积比",
   "explanation": "面积比反推长度比需开正平方根，不能直接作周长比。",
   "self_check": {
    "prompt": "两个相似三角形的面积比为9:25，小三角形周长18厘米，大三角形周长多少厘米？ 请写出判断或计算依据。",
    "reference_answer": "对应长度比为面积比开平方，即3:5；周长比同为3:5，所以大周长18×5/3=30厘米。",
    "criteria": [
     "面积比9:25转3:5",
     "周长30"
    ]
   }
  }
 ],
 "practice": [
  {
   "id": "m9b.31.2.3-q201",
   "note": "独立作答后，按解析检查关键条件和推理。"
  },
  {
   "id": "m9b.31.2.3-q202",
   "note": "独立作答后，按解析检查关键条件和推理。"
  },
  {
   "id": "m9b.31.2.3-q1",
   "note": "独立作答后，按解析检查关键条件和推理。"
  }
 ]
}
