{
  "schema": 1,
  "review_status": "draft",
  "author": "hand",
  "topicId": "m4a.6.1",
  "name": "单式条形统计图",
  "tier": "core",
  "hook": "同一张图里，直条的高矮到底在说什么？为什么不能只看「看起来高很多」？",
  "definition": "单式条形统计图用直条长短表示一类数据的多少，一格可以表示 1 个或多个单位，便于直观比较数量。",
  "why": "条形图把「数量」映射成「长度」，人眼对长度差别最敏感，所以比较快。但读图必须先看纵轴一格代表多少、是不是从 0 开始——否则「看起来高」可能只是刻度被截断造成的错觉。",
  "when_to_use": [
    "只需要比较同类数据的多少",
    "数据是几个并列的类别（班级、月份、项目）",
    "题目要求「从图中读出」「补全统计图」"
  ],
  "steps": [
    "先看纵轴：一格代表多少、起点是不是 0",
    "读直条顶端对应的数",
    "比较长短得出多少关系",
    "补图时先算「这个数要画几格」再画"
  ],
  "worked_example": {
    "prompt": "条形统计图中 A 班 25 人、B 班 30 人，两班相差几人？",
    "verify": "30-25",
    "answer": "5",
    "steps": [
      "先从纵轴读出两个班的人数：A 班 25，B 班 30。",
      "求相差多少用减法：30-25。",
      "30-25=5 人。"
    ]
  },
  "pitfalls": [
    "一格代表2人却按1人读，会把数据读错一倍。",
    "纵轴不从0开始时，条形长度比例可能误导数量比较。",
    "条宽不表示数量，读数应依据条的高度及对应刻度。"
  ],
  "practice": [
    {
      "id": "m4a.6.1-q1",
      "note": "读图后求差"
    },
    {
      "id": "m4a.6.1-q2",
      "note": "说清直条长短表示什么"
    }
  ],
  "check": "先完成本卡读图目标自检，读出纵轴每格对应的人数，再把条高换成人数；随后用补图自检检查“人数→格数”的反向过程。",
  "content_revision": {
    "author_type": "ai",
    "date": "2026-10-26",
    "teacher_review": "pending"
  },
  "objective_coverage": [
    {
      "criterion_index": 0,
      "title": "能读懂单式条形统计图",
      "explanation": "先读标题、类别、单位及每格数值，再把条高对应到数据；不可用条宽判断大小。",
      "self_check": {
        "prompt": "图中纵轴每格2人，A班条高4格、B班6格。分别有几人？",
        "reference_answer": "A班8人，B班12人；每格代表2人。",
        "criteria": [
          "正确读比例尺",
          "两数正确"
        ]
      }
    },
    {
      "criterion_index": 1,
      "title": "能根据数据补全统计图",
      "explanation": "补图时沿用原刻度，条形宽度一致，底部从相同基准出发。",
      "self_check": {
        "prompt": "同图C班10人，条应画多高？补图时注意什么？",
        "reference_answer": "10÷2=5格；从0基准画5格高，与其他条同宽，并标C班。",
        "criteria": [
          "高度5格",
          "同一尺度与类别标记"
        ]
      }
    }
  ],
  "diagram": {
    "src": "/static/diagrams/primary-single-bar-scale.svg",
    "alt": "单式条形统计图纵轴从0开始，以人计，每格5人；A班条高25人，B班30人。横轴分别标两班，不在条顶额外写出比较结果。"
  }
}
