{
  "schema": 1,
  "review_status": "draft",
  "author": "ai",
  "tier": "core",
  "hook": "把一枚小旗向右移动与绕旗杆转半圈，得到的图案有什么不同？",
  "definition": "图案可由基本图形通过平移、旋转、轴对称生成。平移需方向与距离，旋转需中心、方向和角度，轴对称需对称轴；三者保持图形形状大小，但改变位置或朝向的方式不同。",
  "why": "规定变换参数可使别人准确复现设计。平移的各点移动方向和距离一致；旋转的各点绕同一中心转相同角度；对称点在轴两侧且到轴距离相等。",
  "when_to_use": [
    "用一个基本图形重复设计有规律的图案",
    "说明某个图形如何变为另一个图形"
  ],
  "steps": [
    "选一个容易辨认朝向的基本图形并标参考点。",
    "选择变换并写齐方向、距离或中心、角度等参数。",
    "逐次作图，检查大小保持以及参数是否一致。"
  ],
  "worked_example": {
    "prompt": "在方格纸上画一个不对称小箭头，向右平移3格，再向右平移3格。怎样说明规律？",
    "steps": [
      "三支箭头形状大小和朝向都相同，相邻对应点相隔3格。",
      "使用相同的平移两次，最后一支相对第一支向右6格。"
    ],
    "answer": "连续向右平移3格两次"
  },
  "pitfalls": [
    "只说“旋转一下”没有中心和角度，别人不能复现。",
    "平移不改变朝向，转头的箭头一般不是纯平移得到。"
  ],
  "check": "先独立完成下面两项目标自检，再展开参考答案，逐条检查列式、过程和结果的意义。",
  "topicId": "m5a.4.4",
  "name": "设计图案",
  "content_revision": {
    "author_type": "ai",
    "date": "2026-10-26",
    "teacher_review": "pending"
  },
  "objective_coverage": [
    {
      "criterion_index": 0,
      "title": "能用变换设计出有规律的图案",
      "explanation": "设计时应记录足够参数，让规则能够复现与检查。",
      "self_check": {
        "prompt": "在方格纸画字母L形图案，设计三次重复平移并写规则。",
        "reference_answer": "例如每次向右4格，共平移3次，得到4个L；对应点间距每次4格，朝向不变。",
        "criteria": [
          "有基本图形",
          "有明确且重复的变换参数"
        ]
      }
    },
    {
      "criterion_index": 1,
      "title": "能说明图案用了哪种变换",
      "explanation": "从对应点距离和朝向判断变换，并写出所需参数。",
      "self_check": {
        "prompt": "箭头由朝右变朝下，绕同一端点转动90°，是什么变换？要说明什么？",
        "reference_answer": "是旋转，要说明该端点为旋转中心、顺时针90°。",
        "criteria": [
          "判旋转",
          "中心方向角度齐全"
        ]
      }
    }
  ],
  "practice": [
    {
      "id": "m5a.4.4-q3",
      "note": "完成后说清数量关系与每步依据。"
    },
    {
      "id": "m5a.4.4-q1",
      "note": "完成后说清数量关系与每步依据。"
    },
    {
      "id": "m5a.4.4-q101",
      "note": "完成后说清数量关系与每步依据。"
    }
  ]
}
