{
 "schema": 1,
 "review_status": "draft",
 "author": "ai",
 "author_type": "ai",
 "topicId": "m8b.21.2",
 "name": "平行四边形",
 "tier": "core",
 "hook": "平行四边形的对角线互相平分，反过来能否用这个条件判断它？",
 "definition": "两组对边分别平行的四边形叫平行四边形；平行四边形对边相等、对角相等、对角线互相平分；一组对边平行且相等即可判定为平行四边形。",
 "why": "对角线把四边形分成若干三角形；平行产生内错角相等，再借公共边可证全等，得到对边相等、对角线互平分。反向从互平分及对顶角相等证全等，可重新得到两组对边平行。",
 "when_to_use": [
  "已知平行四边形求边角或对角线",
  "要从对边或对角线条件判定四边形"
 ],
 "steps": [
  "先区分已知是平行四边形还是待证明",
  "选对应性质或充分判定条件",
  "需要证明时作对角线，把条件转到三角形全等"
 ],
 "worked_example": {
  "prompt": "四边形ABCD的AC、BD交于O，AO=OC、BO=OD。证明AB∥CD。",
  "answer": "AB∥CD",
  "steps": [
   "∠AOB=∠COD是对顶角，加上AO=OC、BO=OD，得△AOB≌△COD（SAS）。",
   "所以∠BAO=∠DCO，它们是AC截AB、CD所得内错角，故AB∥CD。"
  ]
 },
 "pitfalls": [
  "一组对边相等本身不能判平行四边形。",
  "“一组对边平行且相等”必须是同一组对边。"
 ],
 "check": "独立完成并解释：平行四边形ABCD中，∠A=68°，求相邻内角∠B的度数。 请写出判断或计算依据。；在例题条件下继续证明AD∥BC，并完成四边形判定。",
 "objective_coverage": [
  {
   "criterion_index": 0,
   "title": "能运用平行四边形的性质求边角",
   "explanation": "平行四边形邻角互补、对角相等，对边相等。",
   "self_check": {
    "prompt": "平行四边形ABCD中，∠A=68°，求相邻内角∠B的度数。 请写出判断或计算依据。",
    "reference_answer": "AD∥BC，AB作截线，∠A与∠B是同旁内角，互补，因此∠B=112°。",
    "criteria": [
     "明确AD∥BC",
     "同旁内角和180°"
    ]
   }
  },
  {
   "criterion_index": 1,
   "title": "能用判定定理证明一个四边形是平行四边形",
   "explanation": "对角线互平分可由两组SAS全等分别推出两组对边平行。",
   "self_check": {
    "prompt": "在例题条件下继续证明AD∥BC，并完成四边形判定。",
    "reference_answer": "AO=OC、DO=BO、∠AOD=∠COB，故△AOD≌△COB（SAS），得∠DAO=∠BCO，故AD∥BC；再结合AB∥CD，两组对边平行，ABCD为平行四边形。",
    "criteria": [
     "第二组全等三条件齐全",
     "两组平行共同完成定义判定"
    ]
   }
  }
 ],
 "practice": [
  {
   "id": "m8b.21.2-q201",
   "note": "独立作答后，按解析检查关键条件和推理。"
  },
  {
   "id": "m8b.21.2-q1",
   "note": "独立作答后，按解析检查关键条件和推理。"
  },
  {
   "id": "m8b.21.2-q101",
   "note": "独立作答后，按解析检查关键条件和推理。"
  }
 ]
}
