{
 "schema": 1,
 "review_status": "draft",
 "author": "ai",
 "author_type": "ai",
 "topicId": "m8a.18.4",
 "name": "整数指数幂",
 "tier": "core",
 "hook": "指数从3、2、1逐步减到0、−1时，每一步为什么都在除以底数？",
 "definition": "a⁻ⁿ=1/aⁿ（a≠0），a⁰=1（a≠0）；引入负整数指数幂后，同底数幂的除法可以统一为指数相减。",
 "why": "同底数指数减1，对应除以一次底数。为了让幂的运算规律继续成立，非零a需有a⁰=1，a⁻ⁿ=1/aⁿ；负指数表示倒数，不是给结果加负号，且非零条件不可缺。",
 "when_to_use": [
  "需要计算零指数或负整数指数",
  "科学记数法出现10的负次幂"
 ],
 "steps": [
  "先检查底数非零以及括号范围",
  "把负指数写为正指数幂的倒数",
  "按先乘方后加减顺序计算并验符号"
 ],
 "worked_example": {
  "prompt": "计算(−2)⁻²。",
  "answer": "0.25",
  "steps": [
   "负指数表示倒数，(−2)⁻²=1/(−2)²。",
   "分母为4，所以值为1/4=0.25。"
  ],
  "verify": "(-2)**(-2)"
 },
 "pitfalls": [
  "a⁻²不是−a²，指数负号不控制结果正负。",
  "0⁰和0的负整数次幂不在本规则的定义范围内。"
 ],
 "check": "独立完成并解释：计算2⁻³+2⁰的值，用小数作答。 请写出判断或计算依据。；把a⁻⁴写成不含负指数的分式，已知a≠0，用^表示乘方。 请写出判断或计算依据。",
 "objective_coverage": [
  {
   "criterion_index": 0,
   "title": "能计算负整数指数幂与零指数幂",
   "explanation": "a⁰与a⁻ⁿ的规则均以a≠0为前提。",
   "self_check": {
    "prompt": "计算2⁻³+2⁰的值，用小数作答。 请写出判断或计算依据。",
    "reference_answer": "2⁻³=1/2³=1/8，2⁰=1，所以和为1+1/8=1.125。",
    "criteria": [
     "2⁰=1",
     "2⁻³=1/8且求和正确"
    ]
   }
  },
  {
   "criterion_index": 1,
   "title": "能把负指数写成幂的倒数形式",
   "explanation": "负指数把整个底数对应的正次幂放到分母。",
   "self_check": {
    "prompt": "把a⁻⁴写成不含负指数的分式，已知a≠0，用^表示乘方。 请写出判断或计算依据。",
    "reference_answer": "为保持a⁴·a⁻⁴=a⁰=1，a⁻⁴必须等于1/a⁴，条件a≠0。",
    "criteria": [
     "倒数是1/a⁴",
     "保留a≠0"
    ]
   }
  }
 ],
 "practice": [
  {
   "id": "m8a.18.4-q201",
   "note": "独立作答后，按解析检查关键条件和推理。"
  },
  {
   "id": "m8a.18.4-q202",
   "note": "独立作答后，按解析检查关键条件和推理。"
  },
  {
   "id": "m8a.18.4-q1",
   "note": "独立作答后，按解析检查关键条件和推理。"
  }
 ]
}
