{
 "schema": 1,
 "review_status": "draft",
 "author": "ai",
 "author_type": "ai",
 "topicId": "m9b.34.3",
 "name": "用频率估计概率",
 "tier": "core",
 "hook": "重复试验次数越来越多，频率会不会每一次都比上一次更接近真实概率？",
 "definition": "大量重复试验中，事件发生的频率会稳定在某个常数附近，这个常数可以作为该事件概率的估计值。",
 "why": "频率是实际发生次数除以试验次数，会随样本波动；概率描述稳定机制下事件的可能性。大量独立重复且条件稳定时频率通常围绕概率稳定，可用来估计，但不是单调逼近，也不能把一次实验频率当作精确概率。",
 "when_to_use": [
  "理论概率难算但可重复试验",
  "需要比较小样本与大样本的波动或解释估计"
 ],
 "steps": [
  "记录稳定条件下每次结果和累计次数",
  "算累计事件次数/累计试验次数",
  "把频率作为估计并说明波动，必要时增加重复验证"
 ],
 "worked_example": {
  "prompt": "某硬币抛100次正面56次，抛到总计1000次时累计正面512次，分别算频率并解释。",
  "answer": "0.56与0.512，均为样本频率",
  "steps": [
   "频率分别56/100=0.56、512/1000=0.512；后者用更多试验估计正面概率。",
   "不能由此断言硬币概率恰为0.512，也不能保证下一次频率一定更接近0.5。"
  ]
 },
 "pitfalls": [
  "频率与概率不是同一个对象，有限频率可能偏离真实概率。",
  "累计1000次不能把前100次再加一次，避免重复计数。"
 ],
 "check": "独立完成并解释：一枚均匀硬币前10次正面8次，能否据此说正面概率为0.8？；某装置稳定条件下重复500次，事件发生115次，估计概率并说明一个局限。",
 "objective_coverage": [
  {
   "criterion_index": 0,
   "title": "能说出频率与概率的区别与联系",
   "explanation": "频率依赖已经观察的样本，概率依赖试验机制，两者通过大量重复相联系。",
   "self_check": {
    "prompt": "一枚均匀硬币前10次正面8次，能否据此说正面概率为0.8？",
    "reference_answer": "不能。0.8是这10次频率，均匀硬币的正面概率为0.5；小样本可有较大波动。",
    "criteria": [
     "区分0.8频率与0.5概率",
     "不把有限样本偏差当成必然机制变化"
    ]
   }
  },
  {
   "criterion_index": 1,
   "title": "能用频率估计概率",
   "explanation": "用累计频率估计时应保留样本量，并认识到结果不精确。",
   "self_check": {
    "prompt": "某装置稳定条件下重复500次，事件发生115次，估计概率并说明一个局限。",
    "reference_answer": "估计为115/500=0.23；这是基于500次的近似值，可能存在随机波动，需更多独立重复或检查条件稳定性。",
    "criteria": [
     "计算0.23",
     "说明样本量与估计局限"
    ]
   }
  }
 ],
 "practice": [
  {
   "id": "m9b.34.3-q101",
   "note": "独立作答后，按解析检查关键条件和推理。"
  },
  {
   "id": "m9b.34.3-q102",
   "note": "独立作答后，按解析检查关键条件和推理。"
  },
  {
   "id": "m9b.34.3-q2",
   "note": "独立作答后，按解析检查关键条件和推理。"
  }
 ]
}
