{
  "schema": 1,
  "review_status": "draft",
  "author": "hand",
  "topicId": "m3b.4.2",
  "name": "长方形和正方形的面积",
  "tier": "core",
  "hook": "长 6 厘米、宽 4 厘米的长方形，面积为什么是 24 平方厘米，而不是 20 厘米？",
  "definition": "长方形面积 = 长×宽，正方形面积 = 边长×边长。面积单位是平方单位（平方厘米、平方米）。",
  "why": "用 1 平方厘米的小正方形去铺：每行能铺「长」个，一共铺「宽」行，总数就是长×宽。所以面积算的是「铺满需要多少个单位正方形」，不是「绕一圈多长」。",
  "when_to_use": [
    "题目问「铺满」「占地」「涂色」「多少平方……」",
    "给出长和宽（或边长）",
    "已知面积反求长、宽"
  ],
  "steps": [
    "先把长和宽的单位统一",
    "分清哪条是长、哪条是宽",
    "相乘得到面积",
    "单位写成「平方厘米 / 平方米」"
  ],
  "worked_example": {
    "prompt": "长方形长 6 厘米、宽 4 厘米，面积是多少平方厘米？",
    "verify": "6*4",
    "answer": "24",
    "steps": [
      "每行铺 6 个 1 平方厘米的小正方形。",
      "一共能铺 4 行。",
      "6×4=24 个，所以面积是 24 平方厘米。"
    ]
  },
  "pitfalls": [
    "用 (长+宽)×2 算面积，把周长公式套上来。",
    "长用米、宽用厘米，不换单位直接乘。",
    "答案写「24 厘米」，单位少了个「平方」。"
  ],
  "practice": [
    {
      "id": "m3b.4.2-q1",
      "note": "标准型：长×宽"
    },
    {
      "id": "m3b.4.2-q90",
      "note": "数字换一组，确认公式用对"
    },
    {
      "id": "m3b.4.2-q2",
      "note": "正方形：边长×边长"
    }
  ],
  "check": "能解释「为什么是长×宽」（铺小正方形），并正确写出单位。",
  "content_revision": {
    "author_type": "ai",
    "date": "2026-10-26",
    "teacher_review": "pending"
  },
  "objective_coverage": [
    {
      "criterion_index": 0,
      "title": "能计算长方形与正方形的面积",
      "explanation": "面积按单位正方形个数计量，长宽须先换成同一长度单位。",
      "self_check": {
        "prompt": "长方形长8厘米、宽5厘米和边长6厘米的正方形，面积各多少？",
        "reference_answer": "8×5=40平方厘米；6×6=36平方厘米。",
        "criteria": [
          "两面积正确",
          "平方单位正确"
        ]
      }
    },
    {
      "criterion_index": 1,
      "title": "能说清面积公式的由来",
      "explanation": "用单位正方形铺满：一行几个乘行数就是总个数，推广得到长乘宽。",
      "self_check": {
        "prompt": "用1平方厘米方格说明长4厘米、宽3厘米长方形面积公式。",
        "reference_answer": "每行4格，3行共4×3=12格，所以12平方厘米；长与宽对应每行个数与行数。",
        "criteria": [
          "铺格无空隙无重叠",
          "行列对应长宽"
        ]
      }
    }
  ]
}
