{
 "schema": 1,
 "review_status": "draft",
 "author": "ai",
 "author_type": "ai",
 "topicId": "m8b.23.2",
 "name": "一次函数的图象和性质",
 "tier": "core",
 "hook": "斜率的正负和截距的正负，分别控制直线的什么特征？",
 "definition": "一次函数图象是一条直线；k>0 时 y 随 x 增大而增大，k<0 时 y 随 x 增大而减小；b 是直线与 y 轴交点的纵坐标。",
 "why": "在y=kx+b中，两输入之差引起Δy=kΔx，所以k决定随x增大的升降；x=0时y=b，故b定位与y轴的交点。结合两个坐标轴交点及升降趋势，可以判断经过的象限。",
 "when_to_use": [
  "已知k、b要画图或判象限",
  "要读增减性及与坐标轴的交点"
 ],
 "steps": [
  "分别令x=0与y=0找轴交点",
  "依据k正负判断从左到右上升或下降",
  "按交点划分区间检验x、y符号"
 ],
 "worked_example": {
  "prompt": "分析y=2x−4的增减性和两个轴交点。",
  "answer": "递增；(0,−4)、(2,0)",
  "steps": [
   "k=2>0，故y随x增大而增大。",
   "x=0得y=−4；y=0得2x−4=0，x=2，所以轴交点分别为(0,−4)、(2,0)。"
  ]
 },
 "pitfalls": [
  "b不是与x轴交点的横坐标。",
  "k>0只说明递增，不表示所有函数值为正。"
 ],
 "check": "独立完成并解释：一次函数y=−2x+4的图象不经过哪个象限？ 备选：A. 第一象限；B. 第二象限；C. 第三象限；D. 第四象限 请写出判断或计算依据。；函数y=−3x+9的图象与x轴交点的横坐标是多少？ 请写出判断或计算依据。",
 "objective_coverage": [
  {
   "criterion_index": 0,
   "title": "能由 k、b 的符号判断图象经过的象限",
   "explanation": "象限由x与y符号共同决定，可按零点分段验证。",
   "self_check": {
    "prompt": "一次函数y=−2x+4的图象不经过哪个象限？ 备选：A. 第一象限；B. 第二象限；C. 第三象限；D. 第四象限 请写出判断或计算依据。",
    "reference_answer": "当x<0时y>0，在第二象限；0<x<2时在第一象限；x>2时在第四象限，故不经过第三象限。 正确选项内容：第三象限。",
    "criteria": [
     "列三个区间的符号",
     "排除第三象限"
    ]
   }
  },
  {
   "criterion_index": 1,
   "title": "能说出函数的增减性并求与坐标轴交点",
   "explanation": "增减性看k，轴交点分别令另一坐标为0。",
   "self_check": {
    "prompt": "函数y=−3x+9的图象与x轴交点的横坐标是多少？ 请写出判断或计算依据。",
    "reference_answer": "x轴上的点满足y=0，解−3x+9=0得x=3，所以交点为(3,0)。",
    "criteria": [
     "令y=0",
     "交点写为(3,0)，并知函数递减"
    ]
   }
  }
 ],
 "practice": [
  {
   "id": "m8b.23.2-q202",
   "note": "独立作答后，按解析检查关键条件和推理。"
  },
  {
   "id": "m8b.23.2-q101",
   "note": "独立作答后，按解析检查关键条件和推理。"
  },
  {
   "id": "m8b.23.2-q102",
   "note": "独立作答后，按解析检查关键条件和推理。"
  }
 ]
}
