{
  "schema": 1,
  "review_status": "draft",
  "author": "ai",
  "tier": "core",
  "hook": "又来了5人后队里有13人，求原来人数，为什么要从13里去掉5？",
  "definition": "逆向问题已知变化后的结果，要求变化前的数量。“增加后求原来”满足原来数+增加数=现在数，所以原来数=现在数−增加数。若是减少后求原来，则要用加法恢复。",
  "why": "逆向是沿着变化过程倒着想，而不是所有带“原来”的题都用同一种运算。增加的5人本来不在队里，从现在13人中排除这5人，剩下的正是原来人数。",
  "when_to_use": [
    "已知“又来了/又放入”之后的总数，求原来数",
    "需要从结果倒推变化前的数量，先说明变化方向"
  ],
  "steps": [
    "画出“原来→增加或减少→现在”的过程。",
    "写数量关系，把未知的原来数圈出。",
    "用相反的运算倒推，并按正向过程验算。"
  ],
  "worked_example": {
    "prompt": "又来了5人后队伍有13人，原来有几人？",
    "steps": [
      "原来人数+5=13，所以用13−5。",
      "13−5=8（人）；检查8+5=13。"
    ],
    "answer": "8",
    "verify": "13-5"
  },
  "pitfalls": [
    "看到“又来了”就相加，会把新增人数算两次。",
    "“用去5个后剩8个，原来多少”应8+5，不能套减法。"
  ],
  "check": "先独立完成下面两项目标自检，再展开参考答案，逐条检查列式、过程和结果的意义。",
  "topicId": "m1a.5.5",
  "name": "逆向用加法解决问题",
  "content_revision": {
    "author_type": "ai",
    "date": "2026-10-26",
    "teacher_review": "pending"
  },
  "objective_coverage": [
    {
      "criterion_index": 0,
      "title": "能识别“求原来”的逆向问题",
      "explanation": "识别逆向问题要看未知的是变化前还是变化后。",
      "self_check": {
        "prompt": "放入4块饼干后盒里有12块，未知的是哪个数量？数量关系是什么？",
        "reference_answer": "未知原来数量；原来块数+4=12，是增加后求原来的逆向问题。",
        "criteria": [
          "指出原来未知",
          "关系式正确"
        ]
      }
    },
    {
      "criterion_index": 1,
      "title": "能用减法求出原来的数量",
      "explanation": "增加后求原来做减法，并用加法检验恢复的数量。",
      "self_check": {
        "prompt": "又买6本后共有15本，原来几本？",
        "reference_answer": "15−6=9（本），检验9+6=15。",
        "criteria": [
          "减法列式正确",
          "正向检验成立"
        ]
      }
    }
  ],
  "practice": [
    {
      "id": "m1a.5.5-q1",
      "note": "完成后说清数量关系与每步依据。"
    },
    {
      "id": "m1a.5.5-q101",
      "note": "完成后说清数量关系与每步依据。"
    },
    {
      "id": "m1a.5.5-q102",
      "note": "完成后说清数量关系与每步依据。"
    }
  ]
}
