{
  "schema": 1,
  "review_status": "draft",
  "author": "ai",
  "author_type": "ai",
  "topicId": "m9a.26.2",
  "name": "二次函数的图象和性质",
  "tier": "core",
  "hook": "抛物线的顶点为什么既在对称轴上，又决定全体实数上的最值？",
  "definition": "二次函数图象是抛物线，对称轴为 x=-b/(2a)，顶点坐标为 (-b/(2a), (4ac-b²)/(4a))；a>0 开口向上、有最小值，a<0 开口向下、有最大值。",
  "why": "配成y=a(x−h)²+k后，x与h两侧等距给出相同平方值，因此x=h是对称轴。平方项最小为0：a>0时函数值不小于k，a<0时不大于k，等号在x=h取到。",
  "when_to_use": [
    "需要找对称轴、顶点与开口方向",
    "要判断函数全域增减区间或最值"
  ],
  "steps": [
    "将一般式配方或用h=−b/(2a)求轴",
    "代入h求顶点纵坐标k",
    "按a正负与平方非负解释开口和最值"
  ],
  "worked_example": {
    "prompt": "求y=2x²−8x+3的顶点和最小值。",
    "answer": "顶点(2,−5)，最小值−5",
    "steps": [
      "配方y=2(x²−4x)+3=2(x−2)²−5。",
      "2>0且平方≥0，x=2时最小值−5，顶点为(2,−5)，轴为x=2。"
    ]
  },
  "pitfalls": [
    "y=a(x−h)²+k中括号写x+1时h=−1。",
    "限制定义域后顶点可能不在允许范围，不能直接给全域最值。"
  ],
  "check": "独立完成并解释：将y=x²−6x+4配方，写对称轴、顶点坐标与顶点纵坐标。；函数y=−2(x+1)²+8在全体实数上的最值是什么？ 备选：A. 最小值8；B. 最大值8；C. 没有最值 请写出判断或计算依据。",
  "objective_coverage": [
    {
      "criterion_index": 0,
      "title": "能求抛物线的对称轴与顶点坐标",
      "explanation": "配方y=a(x−h)²+k后，对称轴为x=h，顶点为(h,k)，不要把h符号读反。",
      "self_check": {
        "prompt": "将y=x²−6x+4配方，写对称轴、顶点坐标与顶点纵坐标。",
        "reference_answer": "y=(x−3)²−5，对称轴x=3，顶点(3,−5)，纵坐标−5。",
        "criteria": [
          "配方保留常数−5",
          "轴与顶点完整且不混横纵"
        ]
      }
    },
    {
      "criterion_index": 1,
      "title": "能由 a 的符号判断开口方向与最值",
      "explanation": "最值来自平方非负和a的正负，并须给取等号的x。",
      "self_check": {
        "prompt": "函数y=−2(x+1)²+8在全体实数上的最值是什么？ 备选：A. 最小值8；B. 最大值8；C. 没有最值 请写出判断或计算依据。",
        "reference_answer": "平方项非负，乘−2后不大于0，故y≤8；x=−1时等号成立，所以最大值为8。 正确选项内容：最大值8。",
        "criteria": [
          "a<0推出y≤8",
          "x=−1能取等"
        ]
      }
    }
  ],
  "practice": [
    {
      "id": "m9a.26.2-q201",
      "note": "独立作答后，按解析检查关键条件和推理。"
    },
    {
      "id": "m9a.26.2-q1",
      "note": "独立作答后，按解析检查关键条件和推理。"
    },
    {
      "id": "m9a.26.2-q101",
      "note": "独立作答后，按解析检查关键条件和推理。"
    }
  ],
  "diagram": {
    "src": "/static/diagrams/junior-quadratic-vertex-symmetry.svg",
    "alt": "y=2(x−2)²−5的图象，顶点(2,−5)，轴x=2，成对等距点函数值相等；开口向上，图窗不限制定义域。"
  },
  "content_revision": {
    "author_type": "ai",
    "date": "2026-10-26",
    "teacher_review": "pending"
  }
}
