{
 "schema": 1,
 "review_status": "draft",
 "author": "ai",
 "author_type": "ai",
 "topicId": "m7b.8.1",
 "name": "平方根",
 "tier": "core",
 "hook": "面积为49的正方形边长为7，为什么“49的平方根”却有两个？",
 "definition": "若 x²=a（a≥0），则 x 叫 a 的平方根；正数有两个互为相反数的平方根，算术平方根取其中非负的一个，0 的平方根是 0，负数没有平方根。",
 "why": "平方会消去正负差别：7与−7的平方都为49，因此正数有两个平方根；长度只能非负，所以根号√49规定取非负的算术平方根7。0只有一个平方根0，负数没有实数平方根。",
 "when_to_use": [
  "由平方结果反求原数",
  "看到根号或要求区别平方根与算术平方根"
 ],
 "steps": [
  "先判断被开方数是否非负",
  "求平方等于该数的非负数",
  "按题目要求选择非负根或正负两根"
 ],
 "worked_example": {
  "prompt": "求36的平方根，并计算√36。",
  "answer": "平方根为±6；√36=6",
  "steps": [
   "因为6²=36且(−6)²=36，所以36有两个平方根6、−6。",
   "根号表示算术平方根，必须非负，因此√36=6。"
  ]
 },
 "pitfalls": [
  "√36不能写成±6，根号已经限定非负。",
  "负数在实数范围内没有平方根，不能照抄正数开方。"
 ],
 "check": "独立完成并解释：一个正数的算术平方根是5，这个数的两个平方根是什么？按从小到大写，用逗号分隔。 请写出判断或计算依据。；求√144−√25的值。这里√表示算术平方根。 请写出判断或计算依据。",
 "objective_coverage": [
  {
   "criterion_index": 0,
   "title": "能求非负数的平方根与算术平方根",
   "explanation": "求平方根是求x²=a的所有实数解；正数有一正一负两个根。",
   "self_check": {
    "prompt": "一个正数的算术平方根是5，这个数的两个平方根是什么？按从小到大写，用逗号分隔。 请写出判断或计算依据。",
    "reference_answer": "该数为25；(−5)²=25、5²=25，因此两个平方根是−5和5。",
    "criteria": [
     "先由5²求原数25",
     "给出−5和5"
    ]
   }
  },
  {
   "criterion_index": 1,
   "title": "能区分平方根与算术平方根",
   "explanation": "算术平方根只取非负值，参与后续运算时不要多添正负号。",
   "self_check": {
    "prompt": "求√144−√25的值。这里√表示算术平方根。 请写出判断或计算依据。",
    "reference_answer": "√144=12、√25=5，均取非负值，故12−5=7。",
    "criteria": [
     "两个根号均取非负",
     "结果7"
    ]
   }
  }
 ],
 "practice": [
  {
   "id": "m7b.8.1-q201",
   "note": "独立作答后，按解析检查关键条件和推理。"
  },
  {
   "id": "m7b.8.1-q202",
   "note": "独立作答后，按解析检查关键条件和推理。"
  },
  {
   "id": "m7b.8.1-q1",
   "note": "独立作答后，按解析检查关键条件和推理。"
  }
 ]
}
