{
  "schema": 1,
  "review_status": "draft",
  "author": "hand",
  "topicId": "m4a.6.2",
  "name": "复式条形统计图",
  "tier": "core",
  "hook": "要同时看两个年级男、女生的人数差别，画两张图还是一张？",
  "definition": "复式条形统计图把两组或多组数据并排画在同一张图上，用不同颜色或条纹区分，必须有图例，便于同时比较几组数据。",
  "why": "并排画在同一个坐标系里，两组数据的差可以直接用眼睛比高低，不用来回翻两张图。代价是图变复杂了，所以必须有图例——没有图例就分不清哪根直条是谁。",
  "when_to_use": [
    "需要同时比较两组以上数据",
    "要看出「谁高谁低」的对比，而不只是各自多少",
    "题目要求说明图例或补画一组数据"
  ],
  "steps": [
    "先看图例，确认每种颜色/条纹代表谁",
    "在同一类别里找到并排的几根直条",
    "比较长短，或求差、求和",
    "回答时带上「谁比谁多多少」的完整说法"
  ],
  "worked_example": {
    "prompt": "复式条形统计图中某班男生 22 人、女生 20 人，全班共几人？",
    "verify": "22+20",
    "answer": "42",
    "steps": [
      "先看图例确认哪根是男生、哪根是女生。",
      "男生 22 人、女生 20 人，是并列的两部分。",
      "全班 22+20=42 人。"
    ]
  },
  "pitfalls": [
    "不看图例，把男生和女生的数据读反。",
    "把并排的两根直条当成「相加后的总数」直接读。",
    "忘记复式图必须有图例，自己画图时漏掉。"
  ],
  "practice": [
    {
      "id": "m4a.6.2-q2",
      "note": "读两组数后求和"
    },
    {
      "id": "m4a.6.2-q1",
      "note": "什么情况下该选复式条形图"
    }
  ],
  "check": "先完成本卡“读图并说明图例”的目标自检，逐一说清颜色或条纹代表谁、每格代表几人；再用比较两组差异的自检核对。",
  "content_revision": {
    "author_type": "ai",
    "date": "2026-10-26",
    "teacher_review": "pending"
  },
  "objective_coverage": [
    {
      "criterion_index": 0,
      "title": "能读懂复式条形统计图并说明图例",
      "explanation": "复式图每类有多组数据，图例把颜色或纹理对应到组别，所有条共用尺度。",
      "self_check": {
        "prompt": "图例实条为男生、斜线条为女生，每格2人。某班实条5格、斜线条6格，各多少人？",
        "reference_answer": "男生10人，女生12人；必须按图例识别。",
        "criteria": [
          "图例不颠倒",
          "人数正确"
        ]
      }
    },
    {
      "criterion_index": 1,
      "title": "能比较两组数据的差异",
      "explanation": "同一类别可比较组间差，同一组也可跨类别比较；先确定比较对象。",
      "self_check": {
        "prompt": "A班男10女12，B班男14女10。哪个班男女差更大？",
        "reference_answer": "A班差2人，B班差4人，B班差更大；不能只比较两个班总人数。",
        "criteria": [
          "两差计算正确",
          "比较对象一致"
        ]
      }
    }
  ],
  "diagram": {
    "src": "/static/diagrams/primary-double-bar-legend.svg",
    "alt": "复式条形统计图纵轴每格2人；图例蓝色实条为男生，斜线条为女生。某班两条分别为22人和20人，图例不只使用颜色区分。"
  }
}
