{
  "schema": 1,
  "review_status": "draft",
  "author": "hand",
  "topicId": "m5a.3.1",
  "name": "除数是整数的小数除法",
  "tier": "core",
  "hook": "4.8÷4=1.2。商的小数点为什么必须和被除数对齐？",
  "definition": "除数是整数的小数除法按整数除法计算，商的小数点要与被除数的小数点对齐；不够除时商 0 继续除。",
  "why": "4.8 是 48 个 0.1，平均分成 4 份，每份是 12 个 0.1，也就是 1.2。被除数的计数单位是 0.1，商沿用同样的计数单位，所以小数点位置必须一致。对齐不是规定，是「单位没变」的结果。",
  "when_to_use": [
    "除数是整数、被除数是小数",
    "平均分问题：把一个小数量分成若干份",
    "竖式中途不够除，需要在商里写 0"
  ],
  "steps": [
    "按整数除法列竖式",
    "商的小数点与被除数的小数点对齐",
    "哪一位不够除，商 0 后继续落下一位",
    "用乘法回验：商 × 除数 = 被除数"
  ],
  "worked_example": {
    "prompt": "4.8÷4=？",
    "verify": "4.8/4",
    "answer": "1.2",
    "steps": [
      "4.8 是 48 个 0.1。",
      "48÷4=12，即 12 个 0.1。",
      "12 个 0.1 是 1.2，商的小数点与被除数对齐。"
    ]
  },
  "pitfalls": [
    "商的小数点位置随意点，或者干脆不点。",
    "中途不够除时漏写 0，如 2.04÷2 写成 1.2。",
    "余数不再补 0 继续除，商少了几位。"
  ],
  "practice": [
    {
      "id": "m5a.3.1-q1",
      "note": "标准型：商与被除数对齐"
    },
    {
      "id": "m5a.3.1-q2",
      "note": "数字换一组，检查是否每次都点对"
    },
    {
      "id": "m5a.3.1-q95",
      "note": "先求每瓶多少，再求剩下的总重"
    }
  ],
  "check": "能列竖式算 67.2÷8=8.4，并说明小数点为什么与被除数对齐。",
  "content_revision": {
    "author_type": "ai",
    "date": "2026-10-26",
    "teacher_review": "pending"
  },
  "objective_coverage": [
    {
      "criterion_index": 0,
      "title": "能计算除数是整数的小数除法",
      "explanation": "除数为整数时按位分配，小数点与被除数对齐，余数可继续细分。",
      "self_check": {
        "prompt": "计算7.2÷3，说明商的小数点位置。",
        "reference_answer": "72个0.1平均分3份得24个0.1，即2.4，小数点与7.2对应。",
        "criteria": [
          "商2.4",
          "计数单位或竖式依据"
        ]
      }
    },
    {
      "criterion_index": 1,
      "title": "能正确处理商中间或末尾的 0",
      "explanation": "当前位不够除要商0占位；需要继续除时可在被除数小数末尾补0。",
      "self_check": {
        "prompt": "计算2.04÷2和1.2÷5，说明出现的0。",
        "reference_answer": "2.04÷2=1.02，十分位不够除需商0；1.20÷5=0.24，个位商0并继续细分。",
        "criteria": [
          "两商正确",
          "占位0不遗漏"
        ]
      }
    }
  ]
}
