{
 "schema": 1,
 "review_status": "draft",
 "author": "ai",
 "topicId": "mh1.4.5.2",
 "name": "用二分法求方程的近似解",
 "tier": "core",
 "hook": "不知道√2的小数，能否只靠比较平方不断缩小它所在的区间？",
 "definition": "对连续且端点异号的函数，反复取区间中点，把零点所在区间逐步缩小到满足精度。二分法保持函数连续且区间两端异号，每次保留含零点的半区间；中点恰为根时立即结束。",
 "why": "连续性与异号使至少一个根被保留。每次取中点后若不中根，总有一个半区间仍端点异号；区间长度每轮减半，因此可把近似误差控制在事先给定范围。",
 "when_to_use": [
  "方程难以精确求解但可计算函数符号",
  "已经找到连续且端点异号的夹根区间"
 ],
 "steps": [
  "选择合法夹根区间并核对连续性",
  "算中点及函数值，保留异号的半边",
  "达到区间长度要求再报近似值与误差界"
 ],
 "worked_example": {
  "prompt": "用二分法对x²-2=0从[1,2]进行两轮，写出夹根区间。",
  "steps": [
   "中点1.5，f(1.5)=0.25>0，与f(1)<0配对，留[1,1.5]。",
   "中点1.25，f(1.25)=-0.4375<0，留[1.25,1.5]。",
   "区间长0.25，若报其中点1.375，误差不超过0.125。"
  ],
  "answer": "[1.25,1.5]"
 },
 "pitfalls": [
  "根据中点正负直接决定左右而不比较端点",
  "把区间长度当作小数位数，或对不连续区间套二分法"
 ],
 "objective_coverage": [
  {
   "criterion_index": 0,
   "title": "能按二分法步骤缩小区间",
   "explanation": "新端点须保留异号；区间和函数值要一轮一轮记录。",
   "self_check": {
    "prompt": "对f(x)=x³-2，从[1,2]做两轮二分，列中点符号及保留区间。",
    "reference_answer": "f(1.5)=1.375>0，留[1,1.5]；f(1.25)=-0.046875<0，留[1.25,1.5]。",
    "criteria": [
     "每轮符号计算正确",
     "保留区间始终端点异号"
    ]
   }
  },
  {
   "criterion_index": 1,
   "title": "能说明二分法为什么需要端点异号",
   "explanation": "异号与连续性提供夹根保证；它是该版本算法的前提，不是有根的必要条件。",
   "self_check": {
    "prompt": "为何不能用端点异号版本直接从[-1,1]二分f(x)=x²？函数真的无根吗？",
    "reference_answer": "两端均为1，不满足异号夹根条件，不能直接按这套规则保证保留根；但x=0确实是根，说明异号不是存在根的必要条件。",
    "criteria": [
     "区分算法条件与有根条件",
     "给出0这个根"
    ]
   }
  }
 ],
 "check": "独立完成两项自检并保留推导或作图：每轮符号计算正确；区分算法条件与有根条件。过程目标按下列量规逐项核对，不由一道客观题的得分代替。",
 "practice": [
  {
   "id": "mh1.4.5.2-q201",
   "note": "完成后核对解析中的条件与步骤；完整目标另做下方独立自检。"
  },
  {
   "id": "mh1.4.5.2-q202",
   "note": "完成后核对解析中的条件与步骤；完整目标另做下方独立自检。"
  },
  {
   "id": "mh1.4.5.2-q203",
   "note": "完成后核对解析中的条件与步骤；完整目标另做下方独立自检。"
  }
 ]
}
