{
 "schema": 1,
 "review_status": "draft",
 "author": "ai",
 "topicId": "mh5.6.3.1",
 "name": "二项式定理",
 "tier": "core",
 "hook": "展开(a+b)³时，从三个括号各选a或b；恰好选两次b的三种位置都产生ab²，所以系数是3。",
 "definition": "非负整数n的二项式定理为(a+b)ⁿ=Σₖ₌₀ⁿCₙᵏaⁿ⁻ᵏbᵏ，通项Tₖ₊₁=Cₙᵏaⁿ⁻ᵏbᵏ。共有n+1项，第k+1项对应指数k。二项式系数Cₙᵏ不同于代入具体表达式后某幂项的最终系数，后者还包含数字因子与符号。",
 "why": "展开n个(a+b)的乘积，每个括号选一项。要得到aⁿ⁻ᵏbᵏ，恰需在n个位置中选择k个放b，有Cₙᵏ种，因此合并后的系数为组合数。若b是负数或含x的表达式，其k次幂必须完整带入。",
 "when_to_use": [
  "展开二项式或求指定幂次、常数项、指定项",
  "需区分通项下标和指数，或区分二项式系数与最终系数"
 ],
 "steps": [
  "确定a、b、n，完整写Tₖ₊₁。",
  "整理变量幂次，令指数满足题目条件并检查k为0到n的整数。",
  "代回该k计算符号与数值因子，明确回答的是项还是系数。"
 ],
 "worked_example": {
  "prompt": "求(2x-1)⁴中x²的系数。",
  "steps": [
   "Tₖ₊₁=C₄ᵏ(2x)⁴⁻ᵏ(-1)ᵏ，x的指数为4-k。",
   "令4-k=2得k=2，系数C₄²×2²×(-1)²=6×4=24。"
  ],
  "answer": "24",
  "verify": "(4*3/2)*2**2*(-1)**2"
 },
 "pitfalls": [
  "第3项对应k=2，不是k=3。",
  "(a-b)ⁿ中负号随k奇偶变化，不能只抄正的组合系数。"
 ],
 "objective_coverage": [
  {
   "criterion_index": 0,
   "title": "能写出二项展开式的通项",
   "explanation": "通项要同时保留组合数、两个因子的幂和下标关系。",
   "self_check": {
    "prompt": "写(1+2x)⁵的通项，并指出第4项对应哪个k。",
    "reference_answer": "Tₖ₊₁=C₅ᵏ(2x)ᵏ，k=0,…,5；第4项k=3，为C₅³·8x³=80x³。",
    "criteria": [
     "通项含2ᵏ与xᵏ",
     "第4项对应k=3"
    ]
   }
  },
  {
   "criterion_index": 1,
   "title": "能求指定项的系数",
   "explanation": "指定幂的系数先由指数方程确定k，再算全部数字因子。",
   "self_check": {
    "prompt": "求(1-3x)⁴中x³的系数。",
    "reference_answer": "取k=3，系数C₄³(-3)³=4×(-27)=-108。",
    "criteria": [
     "选k=3",
     "负号及系数-108"
    ]
   }
  }
 ],
 "practice": [
  {
   "id": "mh5.6.3.1-q201",
   "note": "完成后对照解析检查条件、步骤和结果：求(1+2x)⁵展开式中x²的系数。"
  },
  {
   "id": "mh5.6.3.1-q202",
   "note": "完成后对照解析检查条件、步骤和结果：求(x-2)⁴展开式中x³的系数。"
  },
  {
   "id": "mh5.6.3.1-q203",
   "note": "完成后对照解析检查条件、步骤和结果：(a+b)⁶展开式的第4项是哪一项？"
  }
 ],
 "check": "独立完成并写出依据：写(1+2x)⁵的通项，并指出第4项对应哪个k。；求(1-3x)⁴中x³的系数。"
}
