{
 "schema": 1,
 "review_status": "draft",
 "author": "ai",
 "topicId": "mh2.8.4.2",
 "name": "空间点、直线、平面之间的位置关系",
 "tier": "core",
 "hook": "空间两直线不相交就一定平行吗？正方体里哪两条棱能给反例？",
 "definition": "空间点、直线、平面的位置关系：异面直线的概念，直线在平面内、与平面相交、与平面平行。空间两直线可相交、平行或异面；异面是不在同一平面。直线与平面可包含、相交或平行（无公共点）。",
 "why": "平面内不相交的直线只能平行，但空间增加了不共面的可能。用公共点个数描述线面关系更可靠：无点为平行，一个点为相交，至少两点则整条线在面内。",
 "when_to_use": [
  "看空间图判断两直线位置关系",
  "分类直线与平面的公共点情况"
 ],
 "steps": [
  "先查两线是否有公共点，再查方向及是否共面",
  "线面问题数公共点而非凭画面交叉",
  "用实际面或反证说明异面，交叉画线不一定相交"
 ],
 "worked_example": {
  "prompt": "在正方体ABCD-A₁B₁C₁D₁中，ABCD为依次排列的底面，A₁、B₁、C₁、D₁分别在对应底点正上方。判断AB与CC₁、AB与CD的位置关系。",
  "steps": [
   "AB与CC₁不相交，方向一水平一竖直，也不平行。",
   "若共面，两条不平行直线必须相交，矛盾，故异面。",
   "AB与CD是底面两条对边，所以平行。"
  ],
  "answer": "AB与CC₁异面；AB∥CD"
 },
 "pitfalls": [
  "把图上投影交叉当作空间相交",
  "认为直线平行于平面就是平行于面内每条直线"
 ],
 "objective_coverage": [
  {
   "criterion_index": 0,
   "title": "能判断两条直线的位置关系",
   "explanation": "异面必须不共面，常可由不相交且不平行确定。",
   "self_check": {
    "prompt": "在正方体ABCD-A₁B₁C₁D₁中，ABCD为依次排列的底面，A₁、B₁、C₁、D₁分别在对应底点正上方。分别判断AB与BC、AB与A₁B₁、AB与DD₁。",
    "reference_answer": "依次相交于B、平行、异面。DD₁与AB不相交且方向不平行。",
    "criteria": [
     "三种关系均正确",
     "异面判断包含不共面理由"
    ]
   }
  },
  {
   "criterion_index": 1,
   "title": "能说出直线与平面的三种位置关系",
   "explanation": "线面关系由公共点数分类，包含关系不能当作平行。",
   "self_check": {
    "prompt": "在正方体ABCD-A₁B₁C₁D₁中，ABCD为依次排列的底面，A₁、B₁、C₁、D₁分别在对应底点正上方。判断AB、AA₁、A₁B₁与底面ABCD的关系。",
    "reference_answer": "AB包含在底面内；AA₁与底面交于A；A₁B₁与底面平行。",
    "criteria": [
     "三种线面关系完整",
     "交点或无公共点说明准确"
    ]
   }
  }
 ],
 "check": "独立完成两项自检并保留推导或作图：三种关系均正确；三种线面关系完整。过程目标按下列量规逐项核对，不由一道客观题的得分代替。",
 "practice": [
  {
   "id": "mh2.8.4.2-q201",
   "note": "完成后核对解析中的条件与步骤；完整目标另做下方独立自检。"
  },
  {
   "id": "mh2.8.4.2-q202",
   "note": "完成后核对解析中的条件与步骤；完整目标另做下方独立自检。"
  },
  {
   "id": "mh2.8.4.2-q203",
   "note": "完成后核对解析中的条件与步骤；完整目标另做下方独立自检。"
  }
 ]
}
